<?xml version="1.0" encoding="UTF-8"?>
<qnames xmlns:xsi="http://www.w3.org/2001/XMLSchema-instance" xsi:noNamespaceSchemaLocation="identicalQName3.xsd">
    <valueDate>
        <value>
            <val>2007-12-12</val>
        </value>
    </valueDate>
    <valueFloat>
        <value>
            <val>123.12</val>
        </value>
    </valueFloat>
    <valueBoolean>
        <value>
            <value2>
                <val>true</val>
            </value2>
        </value>
    </valueBoolean>
</qnames>
